{
  "id": "hrm:source/lee-2020-nature",
  "type": "source",
  "citation": "Lee et al., Nature, 2020",
  "title": "Hair-bearing human skin generated entirely from pluripotent stem cells",
  "authors": "Lee Jiyoon; Rabbani Cyrus C.; Gao Hongyu; Steinhart Matthew R.; Woodruff Benjamin M.; Pflum Zachary E.; Kim Alexander; Heller Stefan; Liu Yunlong; Shipchandler Taha Z.; Koehler Karl R.",
  "venue": "Nature",
  "year": 2020,
  "kind": "article",
  "doi": "10.1038/s41586-020-2352-3",
  "pmid": "32494013",
  "url": "https://doi.org/10.1038/s41586-020-2352-3",
  "license": "https://www.springernature.com/gp/researchers/text-and-data-mining",
  "resolution": {
    "resolved": true,
    "checkedOn": "2026-09-11",
    "via": "crossref",
    "metadataMatches": true,
    "resolvedTitle": "Hair-bearing human skin generated entirely from pluripotent stem cells",
    "note": "Crossref record found; PubMed id 32494013 located by DOI."
  },
  "provenance": {
    "proposedBy": {
      "type": "ai",
      "name": "Claude Code session e7dc5601 (Anthropic)",
      "model": "claude-opus-5",
      "session": "e7dc5601-1690-47c6-bf13-9ca150d31960"
    },
    "method": "source record generated from the live Crossref work record and a PubMed id lookup by DOI (scripts/seed/2026-09-11-scarless-skin.mjs)",
    "date": "2026-09-11"
  }
}
