{
  "id": "hrm:source/laschke-2016-biotechadv",
  "type": "source",
  "citation": "Laschke et al., Biotechnology Advances, 2016",
  "title": "Prevascularization in tissue engineering: Current concepts and future directions",
  "authors": "Laschke Matthias W.; Menger Michael D.",
  "venue": "Biotechnology Advances",
  "year": 2016,
  "kind": "article",
  "doi": "10.1016/j.biotechadv.2015.12.004",
  "pmid": "26674312",
  "url": "https://doi.org/10.1016/j.biotechadv.2015.12.004",
  "license": "https://www.elsevier.com/tdm/userlicense/1.0/",
  "resolution": {
    "resolved": true,
    "checkedOn": "2026-09-11",
    "via": "crossref",
    "metadataMatches": true,
    "resolvedTitle": "Prevascularization in tissue engineering: Current concepts and future directions",
    "note": "Crossref record found; PubMed id 26674312 located by DOI."
  },
  "note": "Review.",
  "provenance": {
    "proposedBy": {
      "type": "ai",
      "name": "Claude Code session e7dc5601 (Anthropic)",
      "model": "claude-opus-5",
      "session": "e7dc5601-1690-47c6-bf13-9ca150d31960"
    },
    "method": "source record generated from the live Crossref work record and a PubMed id lookup by DOI (scripts/seed/2026-09-11-scarless-skin.mjs)",
    "date": "2026-09-11"
  }
}
