{
  "id": "hrm:source/anderson-2018-nature",
  "type": "source",
  "citation": "Anderson et al., Nature, 2018",
  "title": "Required growth facilitators propel axon regeneration across complete spinal cord injury",
  "authors": "Anderson Mark A.; O’Shea Timothy M.; Burda Joshua E.; Ao Yan; Barlatey Sabry L.; Bernstein Alexander M.; Kim Jae H.; James Nicholas D.; Rogers Alexandra; Kato Brian; Wollenberg Alexander L.; Kawaguchi Riki; Coppola Giovanni; Wang Chen; Deming Timothy J.; He Zhigang; Courtine Gregoire; Sofroniew Michael V.",
  "venue": "Nature",
  "year": 2018,
  "kind": "article",
  "doi": "10.1038/s41586-018-0467-6",
  "pmid": "30158698",
  "url": "https://doi.org/10.1038/s41586-018-0467-6",
  "license": "http://www.springer.com/tdm",
  "resolution": {
    "resolved": true,
    "checkedOn": "2026-09-14",
    "via": "crossref",
    "metadataMatches": true,
    "resolvedTitle": "Required growth facilitators propel axon regeneration across complete spinal cord injury",
    "note": "Crossref record found; PubMed id 30158698 located by DOI."
  },
  "note": "Growth factors, substrate and activation together, across a complete transection in rodent.",
  "provenance": {
    "proposedBy": {
      "type": "ai",
      "name": "Claude Code session b1762020 (Anthropic)",
      "model": "claude-opus-5",
      "session": "b1762020-2a53-4f0e-8cbd-18239bda19a3"
    },
    "method": "source record generated from the live Crossref work record and a PubMed id lookup by DOI (scripts/seed/2026-09-14-spinal-cord.mjs)",
    "date": "2026-09-14"
  }
}
