{
  "id": "hrm:source/barzilai-2016-cellmetab",
  "type": "source",
  "citation": "Barzilai et al., Cell Metabolism, 2016",
  "title": "Metformin as a Tool to Target Aging",
  "authors": "Barzilai Nir; Crandall Jill P.; Kritchevsky Stephen B.; Espeland Mark A.",
  "venue": "Cell Metabolism",
  "year": 2016,
  "kind": "article",
  "doi": "10.1016/j.cmet.2016.05.011",
  "pmid": "27304507",
  "url": "https://doi.org/10.1016/j.cmet.2016.05.011",
  "license": "https://www.elsevier.com/tdm/userlicense/1.0/",
  "resolution": {
    "resolved": true,
    "checkedOn": "2026-09-14",
    "via": "crossref",
    "metadataMatches": true,
    "resolvedTitle": "Metformin as a Tool to Target Aging",
    "note": "Crossref record found; PubMed id 27304507 located by DOI."
  },
  "note": "The TAME trial rationale.",
  "provenance": {
    "proposedBy": {
      "type": "ai",
      "name": "Claude Code session b1762020 (Anthropic)",
      "model": "claude-opus-5",
      "session": "b1762020-2a53-4f0e-8cbd-18239bda19a3"
    },
    "method": "source record generated from the live Crossref work record and a PubMed id lookup by DOI (scripts/seed/2026-09-14-systemic-rejuvenation.mjs)",
    "date": "2026-09-14"
  }
}
