{
  "id": "hrm:source/keeley-2003-lancet",
  "type": "source",
  "citation": "Keeley et al., The Lancet, 2003",
  "title": "Primary angioplasty versus intravenous thrombolytic therapy for acute myocardial infarction: a quantitative review of 23 randomised trials",
  "authors": "Keeley Ellen C; Boura Judith A; Grines Cindy L",
  "venue": "The Lancet",
  "year": 2003,
  "kind": "article",
  "doi": "10.1016/s0140-6736(03)12113-7",
  "pmid": "12517460",
  "url": "https://doi.org/10.1016/s0140-6736(03)12113-7",
  "license": "https://www.elsevier.com/tdm/userlicense/1.0/",
  "resolution": {
    "resolved": true,
    "checkedOn": "2026-09-14",
    "via": "crossref",
    "metadataMatches": true,
    "resolvedTitle": "Primary angioplasty versus intravenous thrombolytic therapy for acute myocardial infarction: a quantitative review of 23 randomised trials",
    "note": "Crossref record found; PubMed id 12517460 located by DOI."
  },
  "note": "Meta-analysis: primary angioplasty versus thrombolysis.",
  "provenance": {
    "proposedBy": {
      "type": "ai",
      "name": "Claude Code session b1762020 (Anthropic)",
      "model": "claude-opus-5",
      "session": "b1762020-2a53-4f0e-8cbd-18239bda19a3"
    },
    "method": "source record generated from the live Crossref work record and a PubMed id lookup by DOI (scripts/seed/2026-09-14-myocardial-infarction.mjs)",
    "date": "2026-09-14"
  }
}
