{
  "id": "hrm:source/sarkaria-2018-neurooncol",
  "type": "source",
  "citation": "Sarkaria et al., Neuro-Oncology, 2017",
  "title": "Is the blood–brain barrier really disrupted in all glioblastomas? A critical assessment of existing clinical data",
  "authors": "Sarkaria Jann N; Hu Leland S; Parney Ian F; Pafundi Deanna H; Brinkmann Debra H; Laack Nadia N; Giannini Caterina; Burns Terence C; Kizilbash Sani H; Laramy Janice K; Swanson Kristin R; Kaufmann Timothy J; Brown Paul D; Agar Nathalie Y R; Galanis Evanthia; Buckner Jan C; Elmquist William F",
  "venue": "Neuro-Oncology",
  "year": 2017,
  "kind": "article",
  "doi": "10.1093/neuonc/nox175",
  "pmid": "29016900",
  "url": "https://doi.org/10.1093/neuonc/nox175",
  "resolution": {
    "resolved": true,
    "checkedOn": "2026-09-14",
    "via": "crossref",
    "metadataMatches": true,
    "resolvedTitle": "Is the blood–brain barrier really disrupted in all glioblastomas? A critical assessment of existing clinical data",
    "note": "Crossref record found; PubMed id 29016900 located by DOI."
  },
  "note": "Is the blood-brain barrier really disrupted in all glioblastomas?",
  "provenance": {
    "proposedBy": {
      "type": "ai",
      "name": "Claude Code session b1762020 (Anthropic)",
      "model": "claude-opus-5",
      "session": "b1762020-2a53-4f0e-8cbd-18239bda19a3"
    },
    "method": "source record generated from the live Crossref work record and a PubMed id lookup by DOI (scripts/seed/2026-09-14-glioblastoma.mjs)",
    "date": "2026-09-14"
  }
}
