{
  "id": "hrm:source/hickson-2019-ebiomedicine",
  "type": "source",
  "citation": "Hickson et al., EBioMedicine, 2019",
  "title": "Senolytics decrease senescent cells in humans: Preliminary report from a clinical trial of Dasatinib plus Quercetin in individuals with diabetic kidney disease",
  "authors": "Hickson LaTonya J.; Langhi Prata Larissa G.P.; Bobart Shane A.; Evans Tamara K.; Giorgadze Nino; Hashmi Shahrukh K.; Herrmann Sandra M.; Jensen Michael D.; Jia Qingyi; Jordan Kyra L.; Kellogg Todd A.; Khosla Sundeep; Koerber Daniel M.; Lagnado Anthony B.; Lawson Donna K.; LeBrasseur Nathan K.; Lerman Lilach O.; McDonald Kathleen M.; McKenzie Travis J.; Passos João F.; Pignolo Robert J.; Pirtskhalava Tamar; Saadiq Ishran M.; Schaefer Kalli K.; Textor Stephen C.; Victorelli Stella G.; Volkman Tammie L.; Xue Ailing; Wentworth Mark A.; Wissler Gerdes Erin O.; Zhu Yi; Tchkonia Tamara; Kirkland James L.",
  "venue": "EBioMedicine",
  "year": 2019,
  "kind": "article",
  "doi": "10.1016/j.ebiom.2019.08.069",
  "pmid": "31542391",
  "url": "https://doi.org/10.1016/j.ebiom.2019.08.069",
  "license": "https://www.elsevier.com/tdm/userlicense/1.0/",
  "resolution": {
    "resolved": true,
    "checkedOn": "2026-09-14",
    "via": "crossref",
    "metadataMatches": true,
    "resolvedTitle": "Senolytics decrease senescent cells in humans: Preliminary report from a clinical trial of Dasatinib plus Quercetin in individuals with diabetic kidney disease",
    "note": "Crossref record found; PubMed id 31542391 located by DOI."
  },
  "note": "Senescent cell reduction in humans, diabetic kidney disease, n=9.",
  "provenance": {
    "proposedBy": {
      "type": "ai",
      "name": "Claude Code session b1762020 (Anthropic)",
      "model": "claude-opus-5",
      "session": "b1762020-2a53-4f0e-8cbd-18239bda19a3"
    },
    "method": "source record generated from the live Crossref work record and a PubMed id lookup by DOI (scripts/seed/2026-09-14-systemic-rejuvenation.mjs)",
    "date": "2026-09-14"
  }
}
