{
  "id": "hrm:source/hirsch-2017-nature",
  "type": "source",
  "citation": "Hirsch et al., Nature, 2017",
  "title": "Regeneration of the entire human epidermis using transgenic stem cells",
  "authors": "Hirsch Tobias; Rothoeft Tobias; Teig Norbert; Bauer Johann W.; Pellegrini Graziella; De Rosa Laura; Scaglione Davide; Reichelt Julia; Klausegger Alfred; Kneisz Daniela; Romano Oriana; Secone Seconetti Alessia; Contin Roberta; Enzo Elena; Jurman Irena; Carulli Sonia; Jacobsen Frank; Luecke Thomas; Lehnhardt Marcus; Fischer Meike; Kueckelhaus Maximilian; Quaglino Daniela; Morgante Michele; Bicciato Silvio; Bondanza Sergio; De Luca Michele",
  "venue": "Nature",
  "year": 2017,
  "kind": "article",
  "doi": "10.1038/nature24487",
  "pmid": "29144448",
  "url": "https://doi.org/10.1038/nature24487",
  "license": "http://www.springer.com/tdm",
  "resolution": {
    "resolved": true,
    "checkedOn": "2026-09-11",
    "via": "crossref",
    "metadataMatches": true,
    "resolvedTitle": "Regeneration of the entire human epidermis using transgenic stem cells",
    "note": "Crossref record found; PubMed id 29144448 located by DOI."
  },
  "provenance": {
    "proposedBy": {
      "type": "ai",
      "name": "Claude Code session e7dc5601 (Anthropic)",
      "model": "claude-opus-5",
      "session": "e7dc5601-1690-47c6-bf13-9ca150d31960"
    },
    "method": "source record generated from the live Crossref work record and a PubMed id lookup by DOI (scripts/seed/2026-09-11-scarless-skin.mjs)",
    "date": "2026-09-11"
  }
}
