{
  "id": "hrm:source/oberlin-1994-jhs",
  "type": "source",
  "citation": "Oberlin et al., The Journal of Hand Surgery, 1994",
  "title": "Nerve transfer to biceps muscle using a part of ulnar nerve for C5–C6 avulsion of the brachial plexus: Anatomical study and report of four cases",
  "authors": "Oberlin C.; Béal D.; Leechavengvongs S.; Salon A.; Dauge M.C.; Sarcy J.J.",
  "venue": "The Journal of Hand Surgery",
  "year": 1994,
  "kind": "article",
  "doi": "10.1016/0363-5023(94)90011-6",
  "pmid": "8201186",
  "url": "https://doi.org/10.1016/0363-5023(94)90011-6",
  "license": "https://www.elsevier.com/tdm/userlicense/1.0/",
  "resolution": {
    "resolved": true,
    "checkedOn": "2026-09-14",
    "via": "crossref",
    "metadataMatches": true,
    "resolvedTitle": "Nerve transfer to biceps muscle using a part of ulnar nerve for C5–C6 avulsion of the brachial plexus: Anatomical study and report of four cases",
    "note": "Crossref record found; PubMed id 8201186 located by DOI."
  },
  "note": "The nerve transfer that changed brachial plexus surgery.",
  "provenance": {
    "proposedBy": {
      "type": "ai",
      "name": "Claude Code session b1762020 (Anthropic)",
      "model": "claude-opus-5",
      "session": "b1762020-2a53-4f0e-8cbd-18239bda19a3"
    },
    "method": "source record generated from the live Crossref work record and a PubMed id lookup by DOI (scripts/seed/2026-09-14-peripheral-nerve.mjs)",
    "date": "2026-09-14"
  }
}
